Id,phrase,response,author,combined
3083,The dignity of truth is lost with much protesting,"Truth may wear velvet, but gossip struts in sequins.",Ben Jonson,"From Philaster (c. 1608–1610), by Francis Beaumont and John Fletcher. Philaster says, ""I'll die nobly, as I lived,"" affirming his honor in the face of death. The line reflects the tragic dignity often afforded to noble characters in Jacobean drama, even amid false accusations."
3084,Conscience is a word that cowards use,Cowards call it conscience; I call it a group chat read at 2am.,Thomas Kyd,"From Philaster (c. 1608–1610), by Francis Beaumont and John Fletcher. Bellario (Euphrasia in disguise) says, ""I wear a sword to save a friend."" This poignant line underlines loyalty and the trope of the cross-dressed female page, a familiar device in Renaissance drama to explore identity and virtue."
3085,A guilty conscience never feels secure,Conscience is that tiny voice you mute when temptation wears cologne.,John Fletcher,"From Women Beware Women (c. 1621), by Thomas Middleton. Livia says, ""Sin, in a woman, is double,"" reflecting societal double standards. The line critiques the moral hypocrisy that judges female transgression more harshly than male, a major theme in Middleton's works."
3086,Man is his own star,Man is his own star—mine's buffering.,George Chapman,"From Women Beware Women (c. 1621), by Thomas Middleton. Bianca laments, ""I was not made to be a mistress,"" voicing the emotional toll of becoming someone's kept woman. The line expresses themes of corruption and the loss of agency, central to this tragedy of manipulation and desire."
3087,There's no art to find the mind's construction in the face,"I read her face like a horoscope: vague, dramatic, mostly wrong.",Thomas Middleton,"From 'Tis Pity She's a Whore (c. 1629–1633), by John Ford. Giovanni says, ""Love is a ravenous thing,"" encapsulating the obsessive and destructive love at the play's heart. The line reflects the play's exploration of taboo passion and moral transgression."
3088,True love's the gift which God has given,True love's a divine gift—usually arrives late and mislabelled.,Francis Beaumont,"From 'Tis Pity She's a Whore (c. 1629–1633), by John Ford. Annabella cries, ""I am the proof of lust,"" as she confronts the consequences of incestuous love. The line speaks to themes of shame, bodily consequence, and patriarchal judgment of women's sexuality."
3089,Death lays his icy hand on kings,Death tapped kings and interns alike—HR called it downsizing.,James Shirley,"From The Broken Heart (c. 1625–1633), by John Ford. Penthea states, ""I am the ghost of what I was,"" as she declines into madness and death. This tragic line underscores themes of emotional repression, ruined love, and the oppressive codes of honor that destroy individuals."
3090,Sweet are the uses of adversity,Joy arrived and said nothing. Tragedy came later and brought snacks.,John Fletcher,"From The Broken Heart (c. 1625–1633), by John Ford. Orgilus says, ""Justice is blind, and so am I,"" having blinded himself out of guilt and despair. The line links literal and metaphorical blindness, critiquing the failures of justice and the personal torment of vengeance."
3091,Even virtue's self is not secure from envy,Even saints are side-eyed in the comment section.,Ben Jonson,"From The Lover's Melancholy (1628), by John Ford. Menaphon says, ""Melancholy is the nurse of frenzy,"" exploring the fine line between sadness and madness. This line captures the play's investigation into emotional extremes and the transformative power of grief and isolation."
3092,I see men's judgments are a parcel of their fortunes,Judgement and fortune shared an Uber—both got out early.,John Webster,"From The City Madam (c. 1632), by Philip Massinger. Luke states, ""The devil can cite Scripture for his purpose,"" borrowing from an idea found in multiple Renaissance works. Here, the line critiques hypocrisy, particularly religious manipulation cloaked in moral justification."
3093,Despair hath slain her own affections,Despair redecorated—painted everything grey and charged me rent.,Thomas Kyd,"From A New Way to Pay Old Debts (c. 1625), by Philip Massinger. The villainous Sir Giles Overreach exclaims, ""I'll make thee rich,"" offering bribery and corruption. The line reveals his relentless greed and control, central to the play's social satire of class ambition and moral decay."
3094,"Envy feeds on the living, not the dead","Envy never RSVPs, yet she always shows up overdressed.",George Chapman,"From The Maid's Tragedy (c. 1611), by Francis Beaumont and John Fletcher. Evadne says, ""I have a knife to cut mine own sad story short,"" as she prepares for a final act of repentance. The line is stark and powerful, emphasizing the tragic consequences of manipulation and lost honor."
3095,A wise man learns more from his enemies than a fool from his friends,My enemy gave better advice than my mirror.,Thomas Middleton,"From The Maid's Tragedy (c. 1611), by Francis Beaumont and John Fletcher. Melantius proclaims, ""Let justice grow from the ruins of the court,"" calling for renewal through moral reckoning. This line reflects the tragic collapse of a corrupt royal order, common in Jacobean revenge drama."
3096,Brave spirits are a balsam to themselves,A brave spirit needs no WiFi to glow.,Ben Jonson,"From The Renegado (1624), by Philip Massinger. Donusa says, ""Freedom is the birthright of the soul,"" asserting spiritual liberty in a context of religious and political conflict. The play deals with East–West cultural exchanges, and this line speaks to inner autonomy over imposed doctrine."
3097,Silence is the perfectest herald of joy,Joy's true herald is silence—or a really good espresso.,John Fletcher,"From The Witch of Edmonton (1621), by Thomas Dekker, John Ford, and William Rowley. Mother Sawyer cries, ""Why should a woman be damned for a witch, when no one pities her?"" protesting her persecution. This line critiques gendered injustice and society's scapegoating of vulnerable women."
3098,The fall of greatness never yet made friends,Greatness fell—everyone clapped and posted it.,John Webster,"From The Witch of Edmonton (1621), by Dekker, Ford, and Rowley. Frank Thorney says, ""I have sinned beyond all pardon,"" confessing his crime of bigamy and murder. The line expresses the despair of a man haunted by guilt and the irrevocability of moral transgression."
3099,Beauty is a witch against whose charms faith melteth into blood,"She bewitched with beauty and a perfectly timed ""hey.""",Thomas Middleton,"From The Captain (c. 1611), by Francis Beaumont and John Fletcher. Jacomo says, ""Lust and wit run a race, and wit is often overthrown,"" wryly commenting on how cleverness fails against base desire. This satirical observation captures a recurring theme of moral versus intellectual control."
3100,All things are with more spirit chased than enjoyed,"The chase thrilled, the catch snored.",Ben Jonson,"From The Devil's Law Case (c. 1620), by John Webster. Romelio says, ""The devil never takes a bribe but pays it back with interest."" This line plays on the moral that wrongdoing carries a cost. It reflects Webster's dark worldview, where sin always exacts a price—often with poetic justice."
